source,title,description,url,image_url,published_at,content,full_text,author,source_name
newsapi,Brasil asume control de embajada de México en Perú tras ruptura diplomática,Por MAURICIO SAVARESE SAO PAULO (AP) — La cancillería brasileña informó el domingo que se había hecho cargo de la representación diplomática de México en Perú tras una ruptura de relaciones entre ambos países luego que la presidenta mexicana Claudia Sheinbaum…,https://www.bostonherald.com/2026/01/25/brasil-asume-control-de-embajada-de-mxico-en-per-tras-ruptura-diplomtica/,https://www.bostonherald.com/wp-content/uploads/2018/11/Herald_BridgePhoto.jpg,2026-01-25T20:03:26Z,"Por MAURICIO SAVARESE
SAO PAULO (AP) — La cancillería brasileña informó el domingo que se había hecho cargo de la representación diplomática de México en Perú tras una ruptura de relaciones entre am… [+2073 chars]","Por MAURICIO SAVARESE SAO PAULO (AP) — La cancillería brasileña informó el domingo que se había hecho cargo de la representación diplomática de México en Perú tras una ruptura de relaciones entre ambos países luego que la presidenta mexicana Claudia Sheinbaum concedió asilo a una ex primera ministra peruana. El Ministerio de Relaciones Exteriores de Brasil afirmó en un comunicado que está “concediendo una solicitud del gobierno mexicano” con el “consentimiento del gobierno peruano”. Añadió que protegerá el edificio de la embajada mexicana, la residencia de su jefe de misión, los bienes y los archivos. Perú rompió relaciones diplomáticas con México hace más de dos meses para protestar por el asilo concedido por Sheinbaum a la ex primera ministra Betssy Chávez, quien había sido condenada a más de 11 años de prisión por cargos de rebelión. Los diplomáticos mexicanos se retiraron en noviembre, pero los dos países continuaron sus relaciones consulares. Un portavoz del Ministerio de Relaciones Exteriores de Perú dijo el sábado que Brasil se había hecho cargo de la embajada mexicana tras coordinar con las autoridades locales. Más temprano el domingo, dos funcionarios del Ministerio de Relaciones Exteriores de Brasil confirmaron a The Associated Press que la bandera de su país ondeaba sobre el edificio en Lima desde el día anterior. Hablaron bajo condición de anonimato porque no estaban autorizados a discutir el asunto públicamente. Las autoridades mexicanas no comentaron el domingo. Chávez, de 36 años, recibió asilo el 3 de noviembre y, según se informa, ha vivido en la embajada mexicana desde entonces, con la policía fuera del edificio buscando arrestarla si sale. Chávez fue condenada por cargos de participar en una iniciativa del expresidente Pedro Castillo para disolver el Congreso el 7 de diciembre de 2022, lo que finalmente llevó a su destitución. Perú ha soportado una larga crisis política que ha envuelto a varios de sus mandatarios.",Associated Press Spanish,Boston Herald
newsapi,Supremo de EU está a punto de pronunciarse sobre la constitucionalidad de los aranceles de Trump pero no sobre su sabiduría,"Forbes México.
 Supremo de EU está a punto de pronunciarse sobre la constitucionalidad de los aranceles de Trump pero no sobre su sabiduría

El futuro de muchos de los aranceles de Donald Trump está en el aire, y se espera que el Tribunal Supremo dicte una se…",https://forbes.com.mx/tribunal-supremo-de-eu-esta-a-punto-de-pronunciarse-sobre-la-constitucionalidad-de-los-aranceles-de-trump-pero-no-sobre-su-sabiduria/,https://cdn.forbes.com.mx/2026/01/Trump-poder-segundo-mandato.webp,2026-01-25T19:56:00Z,"El futuro de muchos de los aranceles de Donald Trump está en el aire, y se espera que el Tribunal Supremo dicte una sentencia sobre las barreras comerciales globales de la administración en cualquier… [+8477 chars]","El futuro de muchos de los aranceles de Donald Trump está en el aire, y se espera que el Tribunal Supremo dicte una sentencia sobre las barreras comerciales globales de la administración en cualquier momento. Pero la cuestión de si una política es legal o constitucional —que los jueces están considerando ahora— no es lo mismo que si es sensata. Y como economista comercial, me preocupa que los aranceles de Trump también supongan una amenaza para la “democracia económica”, es decir, el proceso de toma de decisiones que incorpora los puntos de vista de todos los afectados por la decisión. En muchos sentidos, los fundadores estadounidenses apoyaban la democracia económica. Por eso, en la Constitución de EU, otorgaron exclusivamente al Congreso poderes de elaboración de aranceles e impuestos. Y con razón. Los impuestos a menudo pueden representar un punto conflictivo entre un gobierno y su gente. Por ello, se consideró necesario otorgar esta responsabilidad a la rama más estrechamente vinculada al gobierno y a la gobernada: un Congreso electo. A través de este acuerdo, la legitimidad de aranceles e impuestos se basaría en la aprobación de los votantes; si la gente no estaba satisfecho, podría actuar a través de las urnas. Para ser justos, el presidente no es impotente en materia comercial: en varias ocasiones durante el último siglo, el Congreso ha aprobado leyes que delegan la autoridad de elaboración de aranceles al poder ejecutivo de forma de emergencia. Estas leyes otorgaban al presidente más poder comercial, pero sujetas a controles y equilibrios constitucionales específicos. Lo que está en juego ahora ante el Tribunal Supremo es la interpretación de Trump de una de esas medidas de emergencia, la Ley de Poderes Económicos de Emergencia Internacional de 1977. En abril de 2025, Trump interpretó la ley —que otorga al presidente poderes para responder a “cualquier amenaza inusual y extraordinaria”— para permitirle imponer aranceles de cualquier cantidad sobre productos de casi todos los países del mundo. Sin embargo, la ley no incluye ningún control y equilibrio sobre los poderes del presidente para usar aranceles y ni siquiera menciona los aranceles entre sus recursos. El uso sin restricciones de los aranceles por parte de Trump de esta manera fue sin precedentes en cualquier acción de emergencia jamás tomada por un presidente estadounidense. Dejando de lado las cuestiones constitucionales y legales, la medida plantea varias preocupaciones sobre la democracia económica. El primer peligro es una concentración de poder. Una de las razones por las que los aranceles están sujetos a debate y votación en el Congreso es que proporcionan un proceso transparente que equilibra intereses en competencia. Impide que los intereses de un solo individuo —como un presidente que podría sustituir sus propios intereses por los del interés público en general— controlen el poder completo.",Forbes México Staff,Forbes.com.mx
newsapi,12 maneras en que la administración Trump desmanteló las leyes de derechos civiles y los fundamentos de una democracia inclusiva en su primer año,"Forbes México.
 12 maneras en que la administración Trump desmanteló las leyes de derechos civiles y los fundamentos de una democracia inclusiva en su primer año

A un año del segundo mandato de Trump, su administración ha debilitado sistemáticamente las leye…",https://forbes.com.mx/12-maneras-en-que-la-administracion-trump-desmantelo-las-leyes-de-derechos-civiles-y-los-fundamentos-de-una-democracia-inclusiva-en-su-primer-ano/,https://cdn.forbes.com.mx/2026/01/Donald-Trump.webp,2026-01-25T18:48:00Z,"Un año después de la segunda investidura de Donald Trump, emerge un patrón claro. A través de decenas de órdenes ejecutivas, memorandos de agencias, decisiones presupuestarias y cambios en la aplicac… [+7831 chars]","Un año después de la segunda investidura de Donald Trump, emerge un patrón claro. A través de decenas de órdenes ejecutivas, memorandos de agencias, decisiones presupuestarias y cambios en la aplicación de la ley, la administración ha debilitado las leyes federales de derechos civiles y los cimientos de una democracia racialmente inclusiva en Estados Unidos. Desde sus inicios, Estados Unidos no fue construido para incluir a todos por igual. La Constitución protegía y promovía la esclavitud. La mayoría de los estados limitaban el derecho al voto a los hombres blancos. El Congreso restringió la ciudadanía por naturalización a las “personas blancas libres”. Estas decisiones no fueron accidentales: definieron quién podía pertenecer y ejercer el poder político, y consolidaron una mayoría política racial durante generaciones. Eso empezó a cambiar en la década de 1960. Tras décadas de protestas y presión social, el Congreso aprobó leyes que prohibían la discriminación en el empleo, la educación, el voto, la inmigración y la vivienda. Se encargó a las agencias federales hacer cumplir esas leyes, recopilar datos para identificar la discriminación y condicionar los fondos públicos al cumplimiento. Estas decisiones transformaron la demografía y las instituciones del país, y el Congreso actual es “el más diverso racial y étnicamente de la historia”, según el Centro de Investigación Pew. Las leyes no eliminaron la desigualdad racial, pero hicieron la exclusión más visible y más difícil de justificar. El primer año del segundo mandato de Trump marca un giro brusco en sentido contrario. Infórmate:Irán como riesgo sistémico Retirada acumulativa En lugar de derogar abiertamente las leyes de derechos civiles, la administración se ha centrado en desactivar los mecanismos que las hacen funcionar. Basándome en más de dos décadas de docencia e investigación sobre derechos civiles y en mi experiencia dirigiendo un proyecto de la Facultad de Derecho de la Universidad George Washington sobre democracia inclusiva, considero que este patrón no refleja acciones administrativas aisladas, sino una retirada acumulativa del papel del gobierno federal como garante de los derechos civiles. Durante el último año, el presidente y su administración han tomado una serie de medidas interconectadas:",Forbes México Staff,Forbes.com.mx
newsapi,La era de los superricos,"Según los cálculos realizados por la prensa económica anglosajona, en el mundo habría unos 3.000 multimillonarios. Esta cifra nunca se había alcanzado: me parece característica de la época en la que hemos entrado y cuyos efectos positivos, para la mayoría de …",https://www.abc.es/opinion/guy-sorman-era-superricos-20260125155809-nt.html,https://s3.abcstatics.com/abc/www/multimedia/opinion/2026/01/25/ENFOQUE%20ABC_Superricos_SORMAN_20260125172334-U48575006070VKJ-1024x512@diario_abc.jpg,2026-01-25T18:02:25Z,"Según los cálculos realizados por la prensa económica anglosajona, en el mundo habría unos 3.000 multimillonarios. Esta cifra nunca se había alcanzado: me parece característica de la época en la que … [+6255 chars]","diario de un optimista Guy Sorman Esta funcionalidad es sólo para registrados Esta funcionalidad es sólo para registrados Esta funcionalidad es sólo para suscriptores Según los cálculos realizados por la prensa económica anglosajona, en el mundo habría unos 3.000 multimillonarios. Esta cifra nunca se había alcanzado: me parece característica de la época en la que hemos entrado y cuyos efectos positivos, para la mayoría de nosotros, distan mucho...de ser evidentes. Porque estosmultimillonarios no contribuyennecesariamente al progreso técnico, social y económico del planeta. Entre ellos conviene distinguir entre herederos y creadores. Los herederos representan aproximadamente la mitad. Gracias a sus inversiones financieras, perpetúan el estilo de vida que han heredado sin aportar nada, o de forma excepcional, al patrimonio de sus antepasados. Aparte de los herederos, conviene distinguir entre dos categorías de multimillonarios: los creadores y los depredadores. El ejemplo paradigmático de creador es Bill Gates, que ha puesto la informática al alcance de todos. Sin embargo, cabe señalar que su empresa, Microsoft, ya no contribuye al progreso de la informática. Vive en gran parte de sus rentas: a menudo basta con haber inventado una sola vez algo mejor que no haber inventado nada para ser multimillonario. En esta segunda categoría incluiría a los multimillonarios cuya fortuna se basa en la especulación financiera. Entre los hombres más ricos del mundo se encuentran, por ejemplo, George Soros, Stephen Schwartzmann (Blackstone) o Warren Buffett. Todos ellos, residentes en Estados Unidos, se benefician de su dominio de los mercados financieros y de su capacidad para manejar el dinero ajeno. Bien por ellos. Pero no veo en qué contribuyen al bien común. En el peor de los casos, llevan al mundo a la quiebra, como en 2008. Una característica común a todos estos multimillonarios es su proximidad al poder político. A menudo es precisamente gracias a esta cercanía que se han convertido en multimillonarios: un casofrecuente en China, Rusia, India y Nigeria. Cabe señalar que los países más pobres, lo que parece una paradoja, generan multimillonarios que explotan la miseria masiva monopolizando un recurso natural o un servicio único, como la telefonía móvil: India, Sudán, México y Nigeria, por ejemplo. Esta convivencia entre el dinero y el poder no es absolutamente nueva, pero en nuestra época ha alcanzado proporciones preocupantes. ¿Quién decide en la cima? ¿Es el presidente Trump? ¿O su séquito de grandes fortunas, como Elon Musk y Peter Thiel? Sus instintos e intereses convergen sin que los pueblos obtengan el menor beneficio. Esta lucrativa convergencia es aún más visible en Rusia, India y China. Además de la convergencia entre líderes políticos y multimillonarios, se observa cómo estos controlan ahora la información mediante la compra de medios de comunicación y redes sociales. En Francia, Bernard Arnault, oligarca del lujo (Louis Vuitton, Dior) no solo está cerca del poder, independientemente de la orientación partidista de este, sino que es dueño de la información gracias al control que ejerce sobre la prensa escrita. Otra característica universal de estos multimillonarios es que, en general, no pagan impuestos o prácticamente ninguno gracias a las técnicas denominadas de 'optimización fiscal', que permiten eludir las leyes nacionales y explotar las lagunas de la globalización. ¿Deberíamos rebelarnos contra esta concentración de dinero, poder e información? Es evidente que la democracia liberal no se beneficia de ello. Y aún queda por demostrar que estos multimillonarios contribuyan a la innovación y al crecimiento económico. Las respuestas son, evidentemente, variadas. También es interesante preguntarse qué hacen los multimillonarios con sus miles de millones. Nadie puede gastar tanto, por muy lujosos que sean sus gustos, su colección de coches deportivos, aviones privados y yates. ¿Será entonces el deseo de acumulación, un poco patológico, lo que motiva a estos multimillonarios? Sin embargo, hay una excepción muy importante: la filantropía.",(abc),Www.abc.es
newsapi,El nuevo impuesto a los condones en China no demostrará ser una barrera eficaz frente a la disminución de la tasa de fertilidad del país,"Forbes México.
 El nuevo impuesto a los condones en China no demostrará ser una barrera eficaz frente a la disminución de la tasa de fertilidad del país

China grava los anticonceptivos para impulsar la natalidad, pero la medida es simbólica y poco efectiva.
…",https://forbes.com.mx/el-nuevo-impuesto-a-los-condones-en-china-no-demostrara-ser-una-barrera-eficaz-frente-a-la-disminucion-de-la-tasa-de-fertilidad-del-pais/,https://cdn.forbes.com.mx/2026/01/china-chinos.webp,2026-01-25T15:59:00Z,"Antiguamente la nación más poblada del mundo, China se encuentra ahora entre los muchos países asiáticos que luchan con tasas de fertilidad anémicas. En un intento por duplicar la tasa del país, actu… [+6732 chars]","Antiguamente la nación más poblada del mundo, China se encuentra ahora entre los muchos países asiáticos que luchan con tasas de fertilidad anémicas. En un intento por duplicar la tasa del país, actualmente de 1.0 hijos por mujer, Pekín recurre a una nueva herramienta: impuestos a los condones, las píldoras anticonceptivas y otros métodos anticonceptivos. Desde el 1 de enero, estos artículos están sujetos a un impuesto al valor agregado del 13 %. Mientras tanto, servicios como el cuidado infantil y las agencias de emparejamiento siguen exentos de impuestos. La medida llega después de que China destinara el año pasado 90,000 millones de yuanes (12,700 millones de dólares estadounidenses) a un programa nacional de cuidado infantil que otorga a las familias un pago único de alrededor de 3,600 yuanes (más de 500 dólares) por cada niño de tres años o menos. He estudiado la demografía de China durante casi 40 años y sé que los intentos anteriores del gobierno comunista del país por revertir la caída de las tasas de fertilidad mediante políticas que animaban a las parejas a tener más hijos no han funcionado. No espero que estas nuevas medidas tengan mucho efecto, si es que tienen alguno, en revertir el descenso de la tasa de fertilidad, que se sitúa entre las más bajas del mundo y muy por debajo de la “tasa de reemplazo” de 2.1 necesaria para mantener una población estable. En muchos sentidos, el impuesto del 13 % a los anticonceptivos es simbólico. Un paquete de condones cuesta alrededor de 50 yuanes (unos 7 dólares), y un suministro mensual de píldoras anticonceptivas promedia unos 130 yuanes (19 dólares). El nuevo impuesto no supone en absoluto un gasto importante, ya que añade solo unos pocos dólares al mes. Compárese esto con el costo promedio de criar a un hijo en China, estimado en unos 538,000 yuanes (más de 77,000 dólares) hasta los 18 años, siendo el costo mucho mayor en las zonas urbanas. Un padre de 36 años dijo a la BBC que no le preocupa el aumento de precios. “Una caja de condones puede costar cinco yuanes más, quizá 10, como mucho 20. En un año, eso son solo unos pocos cientos de yuanes, totalmente asequibles”, afirmó. Más contexto:Estiman que México puede atraer hasta 500 mde en inversiones con la Fitur China es uno de los muchos países que han adoptado políticas pronatalistas para hacer frente a la baja fertilidad. Pero rara vez son eficaces. El gobierno de Singapur lleva un par de décadas preocupado por la bajísima tasa de fertilidad del país. Ha intentado aumentarla mediante programas como licencias de maternidad pagadas, subsidios para el cuidado infantil, desgravaciones fiscales y pagos únicos en efectivo. Sin embargo, la tasa de fertilidad de Singapur —actualmente en 1.2— sigue siendo una de las más bajas del mundo. El gobierno incluso empezó a limitar la construcción de apartamentos pequeños de un dormitorio para fomentar viviendas más “familiares” de dos o más dormitorios —cualquiera con hijos apreciará la necesidad de más espacio, ¿no?—. Aun así, ni siquiera eso logró mover la baja tasa de fertilidad.",Forbes México Staff,Forbes.com.mx
newsapi,Claudia Dobles: La arquitecta que ya planificó en Casa Presidencial,"Ejecutiva, técnica y con carácter fuerte, la ex primera dama busca llegar a la Presidencia tras haber ejercido un rol atípico en Casa Presidencial",https://www.nacion.com/revista-dominical/claudia-dobles-la-arquitecta-que-ya-planifico-en/TJYORPZ4NFHA5AUCCOT635ICIM/story/,https://www.nacion.com/resizer/v2/XJEBQCAUUZDJRK4UISKPP27CDQ.JPG?smart=true&auth=f91512af7c428984c728fa2f331e55dcb15bd7630c21d58ee985929a071b3f70&width=1440,2026-01-25T14:10:51Z,"Al mediodía del martes 20 de enero, Claudia Dobles llega en un sedán al Centro de Operaciones del Benemérito Cuerpo de Bomberos, en Santo Domingo de Heredia. Se baja acompañada de su equipo de trabaj… [+14282 chars]","‌‌ ‌ ‌ Al mediodía del martes 20 de enero,Claudia Doblesllega en un sedán al Centro de Operaciones del Benemérito Cuerpo de Bomberos, en Santo Domingo de Heredia. Se baja acompañada de su equipo de trabajo. Lleva prisa, pues va algo tarde a un evento en el que firmará, junto a otros seis candidatos presidenciales, un pacto para impulsar la educación pública en Costa Rica. Dobles, de45 años y candidata presidencial de la Coalición Agenda Ciudadana (CAC),entra sonriendo y saludando a invitados y periodistas. En la tarima principal, la artista Melena realiza un stand up crítico sobre la crisis de la educación en el país. Interactúa y vacila con los presentes. En el papel de maestra de música, Melena le pide una opinión aAriel Robles,candidato presidencial por el Frente Amplio (FA), y aÁlvaro Ramos,del Partido Liberación Nacional (PLN), y bromea conNogui Acosta,exministro de Hacienda del actual gobierno y candidato a diputado por el Partido Pueblo Soberano (PPSO), sobre la falta de financiamiento para los alimentos en las escuelas. —Nogui, ¿qué pasó? Necesitamos el almuerzo para los güilas —le dice. En ese momento entra Claudia Dobles. Melena la mira y suelta: —Claudita, mi amor, diay, ¿la dejó el bus? ¿Se quedó pegada en una presa? Dobles trastabilla en una grada. Un tanto apenada, se reincorpora, pero no deja de sonreír hasta que encuentra un asiento junto a sus rivales políticos.",Julián Navarrete Silva,Nacion.com
newsapi,"Greg Bovino, el azote de la política antiinmigratoria de Trump que lidera las redadas del ICE en Mineápolis","Durante las revueltas del pasado sábado, los agentes de control fronterizo mataron a Alex Pretti, un médico de 37 años que grababa los altercados.
Más información: La policía de Trump mata a sangre fría a otro americano y el gobernador de Minnesota despliega …",https://www.elespanol.com/mundo/america/eeuu/20260125/greg-bovino-azote-politica-antiinmigratoria-trump-lidera-redadas-ice-mineapolis/1003744103243_0.html,https://s3.elespanol.com/2026/01/25/actualidad/1003744103247_261087052_1706x960.jpg?fmt=jpeg,2026-01-25T13:13:44Z,"Greg Bovino, jefe de la Patrulla Fronteriza, lidera las redadas del ICE en Mineápolis y otras ciudades de EE.UU. bajo la política antiinmigratoria de Trump.
El ICE disparó mortalmente a Alex Pretti,… [+6153 chars]","Grego Bovino, comandante del ICE que lidera las represalias en Mineápolis.Reuters Greg Bovino, jefe de la Patrulla Fronteriza, lidera las redadas del ICE en Mineápolis y otras ciudades de EE.UU. bajo la política antiinmigratoria de Trump. El ICE disparó mortalmente a Alex Pretti, médico estadounidense, mientras grababa protestas en Mineápolis, generando gran controversia mediática. Bovino ha encabezado operaciones como la 'Midway Blitz' en Chicago, donde se detuvieron 3.000 inmigrantes, y redadas masivas en Los Ángeles, Charlotte y Nueva Orleans. El comandante es conocido por su estilo autoritario y un atuendo que ha sido comparado públicamente con los uniformes de las SS, lo que ha suscitado críticas políticas. AAlex Pretti, un ciudadano estadounidense de 37 años que trabaja de médico en cuidados intensivos,le mataron los agentes del Servicio de Control de Inmigración de Aduanaspor grabar las revueltas en Mineápolis (Minnesota). El ICE, como se conoce popularmente a esta unidad de policías antiinmigración,disparó a Pretti hasta en cinco ocasiones. El facultativoestaba grabando las protestas. Protegía a una mujer mientras filmaba. Le tiraron al suelo y abrieron fuego. Quien lidera a los agentes del ICE es el comandanteGreg Bovino. Es el jefe general de la Patrulla Fronteriza. Saltó al ojo mediático cuando encabezó las redadas migratorias en Los Ángeles (California), en junio del año pasado. Asimismo, dirigió laoperación Midway BlitzdeChicago(Illinois) en septiembre, así como otros dispositivos policiales como la sucedida enCharlotte(Carolina del Norte) yNueva Orleans(Luisiana), según publica laBBC. ",Antonio Blanco,Elespanol.com
