source,title,description,url,image_url,published_at,content,full_text,author,source_name
newsapi,Años 30 o siglo XIX: ¿A qué otra época histórica se parecen estos tiempos de Trump?,"Al jefe de la fuerza de choque contra la inmigración, Greg Bovino, le gustan las demostraciones marciales de poder. Esta semana ha aparecido marchando por las calles de Mineápolis, paso firme, rodeado de decenas de agentes del Servicio de Control de Inmigraci…",https://www.elperiodico.com/es/internacional/20260124/trump-epoca-historica-hitler-monroe-anos-30-siglo-xix-125880885,https://estaticos-cdn.prensaiberica.es/clip/b2f6a54f-1bb5-4b6d-8539-4f70892fa92d_16-9-discover-aspect-ratio_default_0.jpg,2026-01-24T13:03:15Z,"Al jefe de la fuerza de choque contra la inmigración, Greg Bovino, le gustan las demostraciones marciales de poder. Esta semana ha aparecido marchando por las calles de Mineápolis, paso firme, rodead… [+10406 chars]","Archivo - Greg Bovino, jefe de la agencia de control migratorio ICE,  Broadview, I Oct. 3, 2025./ Erin Hooley / AP Mario Saavedra Al jefe de la fuerza de choque contra la inmigración,Greg Bovino, le gustan las demostraciones marciales de poder. Esta semana ha aparecido marchando por las calles deMineápolis, paso firme, rodeado de decenas de agentes del Servicio de Control de Inmigración y Aduanas (ICE, por sus siglas en inglés). Enfrente, manifestantes desarmados que desafiaban el frío helador de la ciudad americana y que protestaban porlos abusos de la ""migra”; uno de sus agentesmató a tiros a una mujer en una redada en la ciudad. Alguien empezó a gritar a la fuerza policial:""¡Camisas pardas! ¡Camisas pardas!""(en inglés, brownshirts). Se refería a las fuerzas de choque del nazismo, las milicias Sturmabteilung o ""SA"". Incluso elabrigo largo de corte militar del jefe del ICErecordaba al estilo de aquellos viejos tiempos de la Alemania previa a la Segunda Guerra Mundial. Imitando la vestimenta de un oficial de las SS, el jefe de la Guardia Fronteriza racista de Trump, Gregory Bovino, apareció hoy rodeado de esbirros en las protestas de Minneapolis, ordenando más represión.La historia se repite 2 veces, primero como tragedia y luego como farsa.pic.twitter.com/tnFTXcEQnB Las comparaciones de la deriva autoritaria de Estados Unidos con el auge delfascismo de la Alemania de entreguerrasestán cada vez más presentes en los análisis de prensa, entre los profesores de historia comparada y en los discursos de algunos políticos estadounidenses. Desde que Trump invadió Venezuela y decapitó al régimen, también se compara a la nueva administración estadounidense con las del siglo XIX, cuando el país americano ejercía presión contra los vecinos latinoamericanos, que consideraban su esfera de influencia (Doctrina Monroe, Corolario Roosevelt). ¿A qué otro período histórico se parece más el actual? Toda comparación histórica cojea, pero sirve para detectar patrones y así, anticipar soluciones a los problemas que podrían estar por venir. ""Como historiadora de Alemania, sugeriría que las similitudes son mayores entre la Administración estadounidense actual y la Alemania posterior a 1933"", tras el ascenso deAdolf Hitleral poder después de ser elegido democráticamente, dice a este periódicoPamela Swett,profesora de Historia de la Universidad de McMaster en Canadá. ""Veo similitudes entre los primeros años de la dictadura hitlerianay las acciones del presidente de Estados Unidos durante el último año. Entre otras, destacan como ejemplos claros los ataques contra las comunidades inmigrantes dentro de Estados Unidos, la destitución de críticos dentro del Gobierno, la ampliación de la actividad policial y el uso de la violencia estatal contra ciudadanos estadounidenses, y el absoluto desprecio por el derecho internacional, como hemos visto más recientemente en relación con la situación en Venezuela”. Hay más similitudes entre la política ultra de los nacionalsocialistas alemanes y los mensajes políticos de Trump. Laxenofobia y el racismoestán entre los rasgos más evidentes. El político republicano ha hecho de la antiinmigración su política estrella. Y no se trata solo de expulsar, como dijo en campaña, a los inmigrantes que cometen delitos; eso se ha hecho siempre, especialmente en el Gobierno del demócrata Barack Obama, que fue llamado por algunos ""deportador en jefe”. La diferencia ahora son los métodos empleados y, sobre todo, el discurso que rodea a la expulsión. Trump quiere inmigrantes blancos(por ejemplo, sudafricanos), pero no de piel oscura.",Mario Saavedra,Elperiodico.com
newsapi,Precio del dólar HOY sábado 24 de enero de 2026 en México: Conoce si se recupera según el tipo de cambio,"Descubre cuál es el precio del dólar para HOY, sábado 24 de enero del 2026, y si es que el peso se recupera ante el tipo de cambio este fin de semana",https://www.tribuna.com.mx/politica/2026/1/24/precio-del-dolar-hoy-sabado-24-de-enero-de-2026-en-mexico-conoce-si-se-recupera-segun-el-tipo-de-cambio-427405.html,https://www.tribuna.com.mx/u/fotografias/m/2025/6/16/f1280x720-454375_586050_5050.jpeg,2026-01-24T12:00:00Z,"Ciudad de México.- El precio del dólar sigue en un flujo constante, siguiendo las tendencias económicas y políticas, que hacen cambiar su valor a diario, por lo que las páginas oficiales que manejan … [+2093 chars]","Ciudad de México.-Elprecio del dólarsigue en un flujo constante, siguiendo las tendencias económicas y políticas, que hacen cambiar su valor a diario, por lo que las páginas oficiales que manejan si sufrió una caída o si se recupera, según eltipo de cambio, han compartido cuál es el precio actual de la moneda originaria de Estados Unidos dentro de la República Mexicana, en los bancos del país, para la mañana de estesábado 24 de enero del 2026. Como es bien sabido, el precio del dólar varía por diferentes factores, como en temas de política y afectaciones económicas, como es el caso más reciente, y actualmente uno de los más importantes, como los aranceles o aumentos en costos de visa porDonald Trump, así como la cuestión de las fluctuaciones en la bolsa de valores, y diariamente se realizan cambios en los portales especializados en el tema y actualizar los precios, así sea el más mínimo. Según lo informado por el portal de noticias especializado en monitorear los cambios en la moneda estadounidense, El Blooming, el último cambio que se ha realizado es que la moneda mexicana tiene unvalor de 18.06 pesos por cada dólar, que aunque no es mucho, presenta una ganancia del 0.23 por ciento, ante el cierre del viernes 23 de enero, sin embargo, aclaran que en los bancos mexicanos cotizan la compra del dólar en 17.60 pesos, mientras que a la venta está en 18.06 pesos, para este sábado. Banco Afirmecompra en 16.25 y vende en 18.40 pesos mexicanos Banamexcompra 16.87 y vende en 17.79 BBVA Bancomercompra 16.31 y vende en 17.79 Santandercompra en 16.60 y vende en 18.30 Scotiabankcompra en 16.70 y vende en 18.20Banortecompra en 16.15 y vende en 17.70Banco Aztecacompra en 16.25 y vende en 17.54Recuerda que el valor de la divisa oficial de EU se establece de acuerdo datos emergentes sobre la inflación (fenómeno mundial y constante), la tasa de interés y el mercado actual, por lo que su precio puede tener importantes variaciones de un día a otro, por lo que es importante que diariamente se busque información con respecto a los precios que se manejarán en los distintas empresas bancarias.El dólar presenta una ganancia del 0.23 por ciento. InternetFuente: Tribuna del Yaqui Banortecompra en 16.15 y vende en 17.70Banco Aztecacompra en 16.25 y vende en 17.54Recuerda que el valor de la divisa oficial de EU se establece de acuerdo datos emergentes sobre la inflación (fenómeno mundial y constante), la tasa de interés y el mercado actual, por lo que su precio puede tener importantes variaciones de un día a otro, por lo que es importante que diariamente se busque información con respecto a los precios que se manejarán en los distintas empresas bancarias.El dólar presenta una ganancia del 0.23 por ciento. InternetFuente: Tribuna del Yaqui Banco Aztecacompra en 16.25 y vende en 17.54Recuerda que el valor de la divisa oficial de EU se establece de acuerdo datos emergentes sobre la inflación (fenómeno mundial y constante), la tasa de interés y el mercado actual, por lo que su precio puede tener importantes variaciones de un día a otro, por lo que es importante que diariamente se busque información con respecto a los precios que se manejarán en los distintas empresas bancarias.El dólar presenta una ganancia del 0.23 por ciento. InternetFuente: Tribuna del Yaqui",Alejandra HolguÍn,Tribuna.com.mx
newsapi,Obligan a ex migrantes a ir en pañales a EU para pagarles su pensión,"El perro corrió y se abalanzó sobre Norma, moviendo la cola, retozando de alborozo. Pero a sus 85 años, no pudo resistir el peso del animal: cayó y se fracturó una costilla. Esa lesión, la dificultad para caminar y la incontinencia urinaria le han impedido ap…",https://www.milenio.com/internacional/ex-migrantes-deben-viajar-a-estados-unidos-para-cobrar-pensiones,https://cdn.milenio.com/uploads/media/2026/01/23/gobierno-eu-extrema-requisitos-migrantes.jpeg,2026-01-24T09:19:53Z,"El perro corrió y se abalanzó sobre Norma, moviendo la cola, retozando de alborozo. Pero a sus 85 años, no pudo resistir el peso del animal: cayó y se fracturó una costilla. Esa lesión, la dificultad… [+11758 chars]","Para ver esta página correctamente, necesitas activar JavaScript en tu navegador. El perro  corrió y se abalanzó sobre Norma, moviendo la cola, retozando de alborozo. Pero a sus 85 años, no pudo resistir el peso del animal: cayó y se fracturó una costilla. Esa lesión, la dificultad para caminar y la incontinencia urinariale han impedido apersonarse en Estados Unidos, un requisito que exige el país paradarle la pensiónque le dejó su difunto marido. Norma en realidad no se llama Norma. Aquí la nombraremos así porque solicitó el anonimato. Teme que alguien del “cártel” que controla su barrio, al sur de la Ciudad de México, se entere y la extorsionecreyendo que le llueven dólares por la pensión gringa, cuando en realidad está en un lío porque no le depositan ni un dólar. Sucede también con otros jubilados y viudas del pueblo oaxaqueño de donde es oriunda, Santiago Zoochila, afirma Norma, que no han podido denunciar porqueestán enfermos o viven en comunidades recónditasde donde emigraron y retornaron jubilados. Datos de laAdministración del Seguro Socialestadunidense (SSA, su abreviación en inglés) documentan que del total de las 770 mil personas que viven fuera de la Unión Americana y reciben pensión para el retiro del sistema estadunidense, alrededor de61 mil 500 viven en México. La SSA no desglosa el origen étnico o nacionalidad de los jubilados, pero según un estudio de BBVA Research, hay 18 mil 500 ciudadanos nacidos en Estados Unidos que decidieron vivir en México tras su retiro. Del cruce de cifras, se deduce que el resto –unos 43 mil beneficiarios– son exmigrantes mexicanos que lograron nacionalizarse estadunidenses, trabajar legalmente y cotizar para el retiro y la seguridad social. Luego, al cumplir la edad para el retiro, se regresaron a México, como el marido de Norma, quien dejó Los Ángeles para volver con su familia a la Ciudad de México. ​ ​Prueba de vida para recibir pensión",Gardenia Mendoza Aguilar,Milenio
newsapi,Beñat Zaldua: ¿Y si la Inquisición tenía razón con los mapamundis?,"Si tienen una manzana o cualquier fruta redonda a la mano, pélenla y traten de dar una forma plana coherente a toda la piel. Es decir, traten de extenderla a lo largo de un rectángulo que luego puedan meter sin problema entre las páginas de un libro. No es di…",https://www.jornada.com.mx/2026/01/24/opinion/012a1pol,https://www.jornada.com.mx/imagemeta/1200x630BN.jpg,2026-01-24T08:03:31Z,"i tienen una manzana o cualquier fruta redonda a la mano, pélenla y traten de dar una forma plana coherente a toda la piel. Es decir, traten de extenderla a lo largo de un rectángulo que luego puedan… [+4843 chars]","i tienen una manzana ocualquier fruta redonda a la mano, pélenla y traten de dar una forma plana coherente a toda la piel. Es decir, traten de extenderla a lo largo de un rectángulo que luego puedan meter sin problema entre las páginas de un libro. No es difícil, es simplemente imposible, para pesadilla de los cartógrafos que llevan enfrentándose al problema desde que el vasco Juan Sebastián Elkano completó la vuelta al mundo y confirmó que vivimos en una esfera. Gerardus Mercator dedicó parte de su vida a solucionar el problema. La primera vuelta al mundo lo dejó fascinado durante su infancia y en 1552 se lanzó a la elaboración de un atlas global, tarea a la que dedicó 17 largos años y cuyo fruto fue una cosmografía completa en la que dibujó los fundamentos del mapamundi que, 500 años después, seguimos teniendo en mente. El geógrafo Michel Foucher acaba de escribir una pieza interesante sobre este cartógrafo enLe Grand Continenty recuerda: “Si los mapas distorsionan el espacio, no es por negligencia de los cartógrafos, sino por necesidad”. Todos los mapas transforman y, en cierto sentido, ocultan la realidad que desean plasmar. Incluso el mapa de un imperio a escala real que Borges imaginó en uno de sus cuentos no podía sino tapar el mundo real. En el caso de Mercator, su proyección distorsionó los polos, premiando el hemisferio norte, de modo que una isla como Groenlandia parece más grande que Sudamérica entera cuando, en realidad, es poco más grande que México. Foucher recuerda que Mercator fue perseguido y encarcelado por la Inquisición, que lo acusó de herejía por atreverse a adoptar un punto de vista divino. Lo hizo, además, en un momento en el que los europeos más avispados se empezaban a preguntar por qué los pueblos que poblaban el continente americano, de cuya existencia se acababan de enterar, no aparecían en la Biblia. En la Iglesia reformada no estaban muy contentos con Mercator y su atlas histórico y geográfico. Pero pese a la Inquisición, la proyección de Mercator ha llegado con mucha salud y sus defectos intactos al siglo XXI, hasta el punto de ser una de las proyecciones utilizadas, todavía hoy día, por el mapa más usado en todo el mundo: el de Google. Y es bastante probable que, como plantea Foucher, Trump, un niño caprichoso al que le gusta jugar a ser dios, tenga en mente este mapa cuando trata de explicar su hambre de Groenlandia. Así se lo explicó, ya en 2021, al acabar su mandato, a Susan Glasser y Peter Baker, periodistas delNew Yorkery delTimesen Mar-a-Lago: “¿Por qué no lo tenemos? Basta con mirar un mapa (...) No he dejado de repetirlo: miren el tamaño de esta isla, es gigantesca y debería pertenecer a Estados Unidos. No es más que una operación inmobiliaria, sólo que a una escala un poco mayor”. Por motivos erróneos, pero puede que la Inquisición tuviese algo de razón en sus reparos con los mapamundis. Son un peligro en manos de niños con poder. Porque lo cierto es que los argumentos geopolíticos de Trump para apropiarse de Groenlandia son estúpidos. Europa ya baila desde el fin de la Segunda Guerra Mundial al son que le marca Washington y una apropiación por la fuerza de Groenlandia no haría sino implosionar, la principal herramienta con la que EU la mantiene atada en corto militarmente: la OTAN. El caso concreto de Dinamarca es de manual. Truman ya intentó comprar la isla en 1946, alegando que era “un área vital para la defensa de EU” y señalando que así aliviaría la economía danesa de tener que sostener la isla. Carlos Hernández-Echevarría ha recordado estos días enLa Vanguardiala respuesta del gobierno danés: “Eso es como sugerirle a un hombre que se cure de su dolor de muelas cortándose la cabeza”. Dejando al margen la lógica colonial con la que opera Dinamarca en Groenlandia –otro día volveremos por aquí–, lo cierto es que Copenhague se negó a vender Groenlandia, pero le puso una alfombra roja a EU en el tratado bilateral de 1951, todavía vigente, otorgó una patente de corso al ejército estadunidense para que haga en el enclave lo que crea conveniente, con la única condición de que en la entrada de sus bases ondee, junto a las barras y las estrellas, la bandera danesa.",Beñat Zaldua,Jornada.com.mx
newsapi,Fabrizio Mejía Madrid: Palabra de Trump,"Tras invadir Venezuela, Donald Trump confesó que era “por el petróleo”. Sus apoyadores apreciaron que, por fin, un político estadunidense hablara con la verdad. Los críticos, como el comediante John Stewart, extrañaron la añeja retórica cuando cada invasión y…",https://www.jornada.com.mx/2026/01/24/opinion/010a1pol,https://www.jornada.com.mx/imagemeta/1200x630BN.jpg,2026-01-24T08:03:31Z,"ras invadir Venezuela, Donald Trump confesó que era por el petróleo. Sus apoyadores apreciaron que, por fin, un político estadunidense hablara con la verdad. Los críticos, como el comediante John Ste… [+6512 chars]","ras invadir Venezuela,Donald Trump confesó que era “por el petróleo”. Sus apoyadores apreciaron que, por fin, un político estadunidense hablara con la verdad. Los críticos, como el comediante John Stewart, extrañaron la añeja retórica cuando cada invasión y golpe de Estado alentado por Estados Unidos se disfrazaba de luchas por la libertad y la democracia. Que Donald Trump utilice su antirretórica supuestamente directa no quiere decir que diga la verdad o que no busque engañar. Se supone que hablar con claridad es ser serio sobre lo que se dice y, para ser tomado en serio, las palabras deben reflejar la realidad. Nada de esto es cierto con el presidente que dijo, sólo en su último discurso en Davos, que solucionó “ocho o más” guerras, que China no tiene granjas eólicas o que Estados Unidos “le devolvió” Groenlandia a Dinamarca después de la Segunda Guerra Mundial. O, al día siguiente, que los somalíes tenían un IQ bajo. En realidad, estamos ante alguien que lleva la retórica hasta su límite al ya ni siquiera reconocer las normas de autocontención que solían tener la diplomacia y el ejercicio presidencial. Estamos ante un tipo de retórica cuya antirretórica oculta la mentira, el doblez, y el engaño porque presenta su crueldad y vulgaridad como autenticidad y sinceridad sobre lo que “realmente” se piensa. Esta crudeza se disfraza, a su vez, de contraparte de lo políticamente correcto al presentar a éste como falso, timorato e hipócrita. Los que “realmente dicen la verdad” son los que insultan y agreden sin preocuparse ni por la dignidad y la reputación de los demás, menos por los hechos y datos comprobables. Soportan la veracidad usando la repetición, la hipérbole, y la grosería. Ellos son los verdaderos salvadores en el relato de superhéroes detrás de cómo se habla de la política estadunidense. Desde mediados de los años 60 a esa visión se le ha llamado “paranoica”, que es una forma de no decirle “despolitizada”. Arranca en los crímenes contra los Kennedy y sigue hasta el 11 de septiembre y la guerra en Afganistán e Irak. La política en Estados Unidos se entiende más a partir de la conspiración que por la lucha de clases o el conflicto racial y geográfico que jamás han logrado resolver. Como si la política fuera un cómic o un videojuego, unos demonios que se benefician de su propia maldad trabajan en la penumbra de un Estado Profundo o un pantano de pederastas. Así, sin pasar por ninguna evidencia o historia de la indignación social, se señala con claridad a un enemigo y se logra ganar votos electorales. Ese poder oscuro maneja recursos ilimitados para tener influencia sobre la educación, los medios, Hollywood o todo un entramado que manipula las mentes. Por su parte, el héroe es el que sabe contra quién se enfrenta y él encarna a un personaje de historieta, más que representar a una mayoría, contar con un proyecto y un mandato en las urnas. La paranoia política reduce todos los conflictos sociales al exterminio de un otro abominable. Y lee la política, no por lo que es, sino desde la resolución a favor de su personaje imaginario. Así, para QAnon o los Proud Boys que acabaron contratados como agentes del ICE, Trump juega un ajedrez de cuatro dimensiones donde toda consecuencia no calculada de su proceder abrupto y vulgar es, en realidad, parte de un plan maestro para terminar con el enemigo que, en el primer periodo presidencial, era la élite de los medios y las universidades, y ahora son los todos los demás. Así que, al final, quien presume de ser directo y no retórico se convierte en el mensaje más oscuro por descifrar. Otro asunto de la supuesta claridad trumpiana es que no usa palabras que la despolitización considera “huecas”. Cuando la política prescinde de sus palabras más evocativas como “justicia”, “igualdad”, “nación” o “soberanía”, renuncia al afuera que toda participación política necesita. Por eso la movilización del trumpismo llega ese 6 de enero de 2021, rompe el cerco policiaco y no tiene ninguna claridad de si ir por Mike Pence o Nancy Pelosi para ahorcarlos en la picota que han puesto afuera solucionará lo que ellos creen que es un fraude electoral. Se dedican más bien a circular por el Capitolio golpeándose con los policías, sentarse en las curules, y fumarse untoque.Cuando tu proyecto político es insultar a los demás en nombre de la sinceridad, la política se convierte en cambiarle los nombres a todo como única transformación posible: “Golfo de América”, “Consejo de la Paz”, “Centro Trump-Kennedy para las Artes Escénicas”. Es la política entendida como administración de recursos humanos y como mercadotecnia a la que ahora Trump ha agregado “las amenazas falsas y los viajes glorificadores del ego”, como las definió el gobernador de California. El último asunto que viene a la mente es el llamado “lenguaje de crisis”, que plantea una o varias catástrofes y legitima así el uso de políticas extremas y hasta ilegales. Tal es la crisis migratoria que planteó Trump o las muertes por fentanilo o e",Fabrizio Mejía Madrid,Jornada.com.mx
