source,title,description,url,image_url,published_at,content,full_text,author,source_name
newsapi,"José María Egea: ""El Mar Menor se ha convertido en el ecosistema más monitorizado del planeta""","El codirector del documental 'El Mar no cesa' e investigador del CSIC, no pretende señalar con el dedo a los causantes de la contaminación de la laguna. ""Es un problema muy complejo porque son muchos los sectores implicados""
La reforma de la ley del Mar Meno…",https://www.eldiario.es/murcia/cultura/jose-maria-egea-mar-menor-convertido-ecosistema-monitorizado-planeta_1_12931132.html,https://static.eldiario.es/clip/b628df5a-805f-4596-85aa-264826b8165a_facebook-watermarked-aspect-ratio_default_0.jpg,2026-01-24T05:00:45Z,Han pasado 10 años desde el Mar Menor se tornó verde en un desastre ecológico sin precedentes al que le siguió las devastadoras mortandades de peces del año 2019 y 2021. Lo ocurrido vino acompañado d… [+6334 chars],"Elisa M. Almagro 3 Han pasado 10 años desde elMar Menorse tornó verde en un desastre ecológico sin precedentes al que le siguió las devastadoras mortandades de peces del año 2019 y 2021. Lo ocurrido vino acompañado de una gran movilización social, un movimiento que acabó otorgando a la laguna salada unos derechos pioneros con el reconocimiento de supersonalidad jurídicaen el año 2022. Ríos de tinta se han derramado sobre lo ocurrido desde entonces, pero aún no hay consenso entre los distintos grupos sociales -y mucho menos entre las formaciones políticas- sobre por qué el Mar Menor acabó en condiciones tan críticas. Jose María Egea, codirector del documental 'El Mar no cesa' e investigador del CSIC, insiste en que no pretende señalar con el dedo a los causantes de la contaminación de la laguna. No porque no pueda ni quiera, sino porque le faltarían manos: “Es un problema muy complejo porque son muchos los sectores implicados. No hay dos bandos claros, sino que hay muchas convergencias y divergencias, posturas que se acercan y se alejan en función de quién las dice”, explica. De esa complejidad nace este largometraje de dos horas, que pretende, sin juicios de valor, contraponer las perspectivas de los distintos sectores implicados en el Mar Menor: los impactos del sector agrícola y ganadero, la red de saneamiento municipal, las estaciones depuradoras, el turismo, la minería, la influencia del nivel freático del acuífero, las consecuencias del sector pesquero y las consecuencias en las especies amenazadas. “Hasta ahora todo lo que se había hecho en medios de comunicación o en documentales había sido muy sesgado y parcial, y dependía mucho dequien estuviera detrás de esa información”, observa Egea. El documental se estrenará este domingo 25 de enero a las 17:00 en los cines de Centrofama en Murcia, y tendrá un segundo pase el lunes 26 a las 17:00 horas y el martes 27 a las 19:00 horas. Ha sido premiado por la 'Mejor edición' en el Festival Internacional de Cine Ambiental y Animal (FICAA) de Ciudad de México (México); y seleccionado en el Festival of Social and Environmental Cinema PLANET.Doc en Santa Catarnina (Brasil) y el Zuma International Film Festival en Abuya (Nigeria). “Hemos hecho 40 entrevistas [Egea y Paco Portero, quien codirige el documental]. Recuerdo que, cuando empezamos a esbozar sobre el papel cómo queríamos que fuese el documental, hablábamos de diez imprescindibles. Diez personas que tuvieran una voz reconocida con autoridad y competencia. Pero cuando abrimos la puerta de este campo tan complejo y empezamos a tirar del hilo, decidimos que no queríamos dejar a nadie sin que pudiera dar su visión y su punto de vista”, ha explicado. Todas estas voces, tan dispares entre sí, se conjugan en una especie de diálogo: “Quisimos hacerlo parecido a 'La pelota vasca, la piel contra la piedra', el documental de Julio Médem, en el que constantemente hay una réplica y contrarréplica en función de un tema concreto”, abunda.",Elisa M. Almagro,Eldiario.es
newsapi,"Don Winslow: ""Sabemos que a los matones como Trump hay que darles un puñetazo metafórico en la nariz""","El autor de la 'trilogía del cártel' y la mafiosa 'trilogía de Danny Ryan' regresa a la escritura tras anunciar en 2022 su retiro para centrarse en el activismo político contra Donald Trump. Lo hace con 'Resultado final' (Harper Collins), seis relatos crimina…",https://www.elperiodico.com/es/ocio-y-cultura/20260124/entrevista-don-winslow-libro-relatos-resultado-final-donald-trump-125989369,https://estaticos-cdn.prensaiberica.es/clip/c1ab49ff-a3bd-478a-bd41-0cea57901840_16-9-discover-aspect-ratio_default_0_x607y269.jpg,2026-01-24T04:00:09Z,El autor de la'trilogía del cártel'y la mafiosa'trilogía de Danny Ryan' regresa a la escritura tras anunciar en 2022 su retiro para centrarse en el activismo político contra Donald Trump. Lo hace con… [+7874 chars],"Don Winslow, en Barcelona, en 2018/ Joan Cortadellas Ramón Vendrell El autor de la'trilogía del cártel'y la mafiosa'trilogía de Danny Ryan'regresa a la escritura tras anunciar en 2022 su retiro paracentrarse en el activismo político contra Donald Trump. Lo hace con'Resultado final'(Harper Collins),seis relatos criminales secos y afiladoscomo sendos martinis, en los quese aleja de la violencia cruda. Parece habérselo pasado bomba escribiéndolos. ¿Qué le ha empujado a volver a escribir ficción? Me tomé un descanso de la escritura para concentrarme en asuntos políticos. Para, por así decirlo, librar una batalla que acabamos perdiendo. Pero una serie de personajes, más que de historias, empezaron a hablar en mi cabeza y, de algún modo, reclamarme que los escribiera. Cedí, me senté y los escribí. ¿Hay un nexo entre los siete relatos de 'Resultado final'? En primer lugar, este libro me permitió escribir lo que me diera la gana en el estilo que me diera la gana. Fue liberador y divertido escribirlo. Más allá de esto, creo que el nexo principal gira en torno a la identidad. Cómo nuestra identidad cambia, a veces lentamente a lo largo del tiempo, a veces muy rápidamente. Pensamos que somos una cosa y de repente elegimos ser o tenemos que ser otra cosa. También me parece que he escrito sobre el mismo tema que he desarrollado a lo largo de toda mi carrera, que es la cuestión central de la ficción criminal: ¿cómo vives decentemente en un mundo indecente? ¿Cómo intentas hacerlo, y puedes hacerlo? ¿Existen atracadores tan listos, elegantes y éticos como John Highland, el protagonista del relato titular? Sí, y yo los conozco. Si vienes a Estados Unidos, intentaré presentarte a alguno, pero no te lo puedo garantizar. Hay un amplio espectro de atracadores, desde los estúpidos, violentos y descuidados hasta los altamente profesionales. Cuanto más profesionales son, menos violentos son. No necesariamente por una cuestión moral, sino porque saben que si les atrapan la violencia incrementará mucho sus condenas. De modo que los realmente buenos hacen todo lo que pueden para reducir las posibilidades de que la cosa se tuerza y genere violencia. Conozco a uno retirado que va a cenar con el policía que una vez lo encarceló, también retirado. El policía me dijo: 'Si hubiera sido necesario, le habría disparado. Sin duda'. Don Winslow, en la imagen promocional de 'Resultado final'/ Robert Gallaher / Harper Collins",Ramón Vendrell,Elperiodico.com
newsapi,Nearshoring en México: ‘vivito y coleando’,Víctor Piz reflexiona sobre el Plan México y la relocalización de empresas en este gobierno.,https://www.elfinanciero.com.mx/opinion/victor-piz/2026/01/23/nearshoring-en-mexico-vivito-y-coleando/,https://www.elfinanciero.com.mx/resizer/v2/HS3T7FL4UJHRXK25HWNNRUHAIA.jpg?smart=true&auth=804e080ffdfbf3bd9aeff3a557c2bd53109ac98475fddb6c8eb3f7e7ffc8afe5&width=1200&height=630,2026-01-24T04:00:00Z,"El Plan México establece una serie de metas a 2030 para el desarrollo regional del país, entre las que destacan promover la relocalización de empresas e industrias, también conocida como nearshoring.… [+4109 chars]","El Plan México establece una serie de metas a 2030 para el desarrollo regional del país, entre las que destacan promover la relocalización de empresas e industrias, también conocida comonearshoring. Como plan de largo plazo, prevé elevar el contenido nacional y regional sustituyendo importaciones industriales. Con ese fin, el año pasado se publicó un decreto por el que se otorgan estímulos fiscales en los Polos de Desarrollo Económico del Bienestar, cuyo establecimiento se considera indispensable para la implementación del Plan México. Aunque el gobierno de la presidenta Claudia Sheinbaum ha tratado depromover la llegada denuevasempresasal paísen el marco delnearshoring, el componente de utilidades reinvertidas de la Inversión Extranjera Directa (IED) es el predominante sobre nuevas inversiones y cuentas entre compañías. Al tercer trimestre de 2025, la IED alcanzó 40 mil 906 millones de dólares, lo que representa un récord histórico. De la cifra reportada por la Secretaría de Economía, 67.8 por ciento –más de dos terceras partes– correspondió a reinversión de utilidades, 16 por ciento a nuevas inversiones y una proporción muy similar a cuentas entre compañías. El Plan México plantea promover la relocalización enun contexto dereducido espacio fiscal,bajo crecimiento económico y elevadas tensiones comercialespor la imposición de aranceles a las exportaciones mexicanas al mercado de Estados Unidos por parte de la administración Trump. Aranceles que, con excepciones en algunos sectores, México ha podido evitar por el tratamiento preferencial otorgado a las mercancías que cumplan el T-MEC. Sin embargo, todo esto conformó un entorno de elevada incertidumbre que, además deafectar el apetito de inversión y debilitar el ambiente de negocios, contribuyó a retrasar el proceso de relocalización en el país. De acuerdo con datos recopilados por la consultora Integralia en un reporte anual de 2025 sobre elnearshoring,la relocalización se moderó durante el año recién concluidoen medio de un entorno marcado por la incertidumbre arancelaria y la caída de la inversión productiva, la actividad industrial y el empleo manufacturero.",Víctor Piz,El Financiero
newsapi,Lula: Brasil nunca volverá a ser colonia de nadie,"""Brasil quiere tener relaciones con Estados Unidos, quiere tener relaciones con Cuba, quiere tener relaciones con China, quiere tener relaciones con Rusia. No tenemos ninguna preferencia"", afirmó el mandatario, al advertir que no tolerará relaciones de subord…",https://actualidad.rt.com/actualidad/583704-lula-brasil-no-volver-colonia-nadie,https://mfes.b37m.ru/actualidad/public_images/2026.01/article/69743528e9ff712ee4761bd8.jpg,2026-01-24T03:21:51Z,"El presidente de Brasil, Luiz Inácio Lula da Silva, enfatizó que su país puede tener relaciones diplomáticas con cualquier Estado, sin alineamientos exclusivos, y que nunca aceptará ""volver a ser col… [+1115 chars]","El presidente de Brasil, Luiz Inácio Lula da Silva, enfatizó que su país puede tener relaciones diplomáticas con cualquier Estado, sin alineamientos exclusivos, y que nunca aceptará ""volver a ser colonia"" de nadie. En un discurso cargado decríticascontra su homólogo estadounidense, Donald Trump, el mandatario brasileño denunció el deterioro del multilateralismo, sustituido por la ""ley del más fuerte"". ""Vivimos un momento muy crítico en la política mundial. El multilateralismo se está desbancando en favor del unilateralismo. Se impone la ley del más fuerte"",aseveró, y manifestó que la Carta de la ONU ""está siendo destrozada"". En ese contexto, aseguró que en las últimas semanas intensificó contactos diplomáticos para articular una respuesta internacional al escenario planteado. Señaló que mantuvo conversaciones con los líderes de Rusia, China, India, Hungría, México, entre otros. ""Brasil quiere tener relaciones con Estados Unidos, quiere tener relaciones con Cuba, quiere tener relaciones con China, quiere tener relaciones con Rusia. No tenemos ninguna preferencia"", destacó. No obstante, advirtió que su país no tolerará relaciones de subordinación. ""Lo que ya no aceptamos es volver a ser colonia para que alguien mande sobre nosotros"", subrayó el mandatario.","RT en Español
 , RT en Español",RT
newsapi,"Lula acusa a Trump de querer ser dueño de ""una nueva ONU""","El presidente de Brasil dijo que el mundo vive un momento ""muy crítico"", denunció el avance del unilateralismo y cuestionó a su par estadounidense por querer ""crear una nueva ONU"".",https://actualidad.rt.com/actualidad/583696-lula-acusa-trump-querer-ser-dueno-onu,https://mfes.b37m.ru/actualidad/public_images/2026.01/article/69741ca259bf5b03887e0d7e.jpg,2026-01-24T01:29:51Z,"El presidente de Brasil, Luiz Inácio Lula da Silva, afirmó este viernes que el mundo atraviesa un momento ""muy crítico"" y advirtió que la Carta de las Naciones Unidas está siendo ""rasgada"", mientras … [+1694 chars]","El presidente de Brasil, Luiz Inácio Lula da Silva, afirmó este viernes que el mundo atraviesa un momento""muy crítico""y advirtió que la Carta de las Naciones Unidas está siendo""rasgada"", mientras en la política internacionalprevalece ""la ley del más fuerte"". Lula hizo esas declaraciones durante el 14.° Encuentro Nacional del Movimiento de los Trabajadores Rurales Sin Tierra (MST) en Salvador, segúninformóG1. En su mensaje, Lula manifestó que el multilateralismo está siendodesplazadoporacciones unilaterales, y dijo que ese giro se refleja tanto en crisis en América Latina como en cambios políticos en países centrales. En ese marco, mencionó elecciones recientes en la región con victorias de candidatos de derecha y también la elección de Donald Trump en Estados Unidos como parte de un contexto que, según su mirada, incrementa losriesgos para la democracia. El mandatario brasileño apuntó directamente contra Trump y criticó su propuesta delConsejode Paz, al considerar que expresan una lógica de imposición internacional. ""En vez de corregir la ONU, como la gente reivindica desde 2003, con la entrada de nuevos países —como México, Brasil y países africanos—, lo que está pasando es que el presidente Trump está haciendo una propuesta decrear unanueva ONU, como si él solo fuese el dueño de la ONU"", afirmó. Lula también aseguró que en las últimas semanas intensificó contactos diplomáticos para articular una respuesta internacional al debilitamiento del multilateralismo: dijo que habló con dirigentes de Rusia, China, India, Hungría y México, entre otros. Reiteró que Brasil busca mantener relaciones con distintos países sin alineamientos exclusivos, pero marcó un límite:""Lo que ya no aceptamos más es volver a ser colonia para que alguien mande sobre nosotros"", sostuvo. Todo sobre el Consejo de Paz de Trump, que aspira a ser alternativa a la ONU, en estanota","RT en Español
 , RT en Español",RT
newsapi,"La partida de Risk de Trump en el Atlántico, de Groenlandia al Gran Marruecos: la amenaza que se cierne sobre Canarias","Las reivindicaciones de Estados Unidos sobre la isla del Ártico, Venezuela o el Canal de Panamá invitan a pensar en un nuevo mundo en el que las potencias resuelvan sus disputas territoriales usando la fuerza bruta y no la diplomacia.
Más información: Trump d…",https://www.elespanol.com/reportajes/20260124/partida-risk-trump-atlantico-groenlandia-gran-marruecos-amenaza-cierne-canarias/1003744102141_0.html,https://s3.elespanol.com/2026/01/23/actualidad/1003744102245_261072735_1706x959.jpg?fmt=jpeg,2026-01-24T00:40:00Z,"En 1988, Grecia y Turquía mandaron sendas delegaciones al Foro Económico de Davos en busca de un acuerdo al conflicto diplomático que llevaba un año amenazando con convertirse en una guerra abierta e… [+11615 chars]","Ilustración realizada con IA de Donald Trump jugando al Risk en el Despacho Oval.Ilustración: Lina Smith | Recursos: Midjourney, Reuters En 1988, Grecia y Turquía mandaron sendas delegaciones al Foro Económico de Davos en busca de un acuerdo alconflicto diplomáticoque llevabaun año amenazandocon convertirse enuna guerra abierta entre ambos países. El objeto de disputa eranlas islas del Mar Egeo, en su inmensa mayoría pertenecientes a Grecia, peroansiadas por Turquía, especialmente desde que, durante la crisis de 1973, se descubrieran yacimientos de petróleo por explotar. La disputa no era nueva ni acabó ahí. En gran parte, junto a lalucha por la soberanía de Chipre, isla dividida en un área de influencia turca y otra griega, los rifirrafes en el Egeo fueron la causa de que Turquía se quedara fuera de la Unión Europea cuando solicitó su inclusión en los años 90. Lanzamiento de prueba del misil hipersónico turco Tayfun Block 4.Roketsan Hoy en día, la cuestión sigue abierta, a pesar de los continuos intentos de mediación y los distintos acuerdos posteriores, siempre con lapoderosa amenaza militar turca de fondo. Es inevitable comparar, de alguna manera, aquella refriega y su posterior solución temporal con lo que ha sucedido este año, casi cuatro décadas después,entre Estados Unidos y la Unión Europearespecto a Groenlandia. De nuevo, tenemos una isla con una localización geográfica ambigua sobre la quedos países reclaman su soberanía. De nuevo, tenemos una negociación en Suiza y un acuerdo que tampoco parece que vaya a acabar del todo con el problema de raíz. El empeño con el que Trump defendió lanecesidad imperiosa de hacerse con Groenlandiatanto en Davos como en declaraciones públicas anteriores no parece fácil de matizar. Lo ha intentado Mark Rutte, el secretario general de la OTAN, con una propuesta de la que se desconocen los detalles, pero que no ha contado con la consultani a Dinamarca ni a las propias autoridades groenlandesas.",Guillermo Ortiz,Elespanol.com
newsapi,¡Hace historia! Plata supera los 100 dólares por onza y sacude los mercados,"El precio de la plata superó oficialmente los 100 dólares por onza por primera vez en la historia, consolidando un avance aproximado de 40 por ciento en lo que va de 2026.Este movimiento marca un hito importante para los mercados y confirma que los metales pr…",https://www.milenio.com/negocios/historia-plata-supera-los-100-dolares-por-onza,https://cdn.milenio.com/uploads/media/2014/05/01/formas-apreciar-coleccion-stufen-fabricante-1.jpeg,2026-01-24T00:11:00Z,"El precio de la plata superó oficialmente los 100 dólares por onza por primera vez en la historia, consolidando un avance aproximado de 40 por ciento en lo que va de 2026. 
Este movimiento marca un … [+4388 chars]","Para ver esta página correctamente, necesitas activar JavaScript en tu navegador. Elprecio de la platasuperó oficialmente los 100 dólares por onzapor primera vez en la historia, consolidando un avance aproximado de  40 por ciento  en lo que va de 2026. Este movimiento marca un hito importante para los mercados y confirma que los metales preciosos están viviendo uno de sus momentos más fuertes en los últimos años. De acuerdo conDiego Albuja, analista de mercados ATFX LATAM, esta subida llega en un contexto global donde los inversionistas  vuelven a buscar activos refugio debido a la incertidumbre económica y geopolítica. Sin embargo, señaló queel oro se mantiene firme en máximos, lo que también  impulsa el interés por la plata, que tiene una ventaja adicional. No sólo es un metal defensivo, sino que también tiene una fuerte demanda industrial,  “lo que la vuelve aún más atractiva en momentos de tensión”. Asimismo, agregó que otro factor importante es queel mercado físico también está mostrando señales de presión, con primas más elevadas en ciertos países, lo que refuerza la idea de que no se trata sólo de especulación financiera, sino de un reajuste real entre oferta y demanda. Igualmente, resaltó que mientras sigan presentes laincertidumbre global, la demanda por refugio y la presión sobre las monedas, la plata podría mantenerse en niveles elevados durante las próximas semanas. De igual forma, Felipe Mendoza, director general de IMB Capital Quants, señaló que el  incremento en la valoración de las empresas mineras, tanto en México como a nivel internacional, se explica fundamentalmentea través del concepto de descuento. Mediante este mecanismo, el mercado financiero incorpora hoy las ganancias que se esperan para el futuro o vieron  en los reportes empresariales, lo que ha generado un interés masivo en la adquisición de sus acciones.",Fernanda Murillo,Milenio
newsapi,Dólar se ubica en 17.3677 pesos; la moneda mexicana gana 1.58% en la semana,"Forbes México.
 Dólar se ubica en 17.3677 pesos; la moneda mexicana gana 1.58% en la semana

 La moneda nacional hiló tres sesiones con avances y se mantuvo en su mejor nivel frente al dólar desde finales de mayo de 2024, según datos de Banxico.
Dólar se ubic…",https://forbes.com.mx/dolar-se-ubica-en-17-3677-pesos-la-moneda-mexicana-gana-1-58-en-la-semana/,https://cdn.forbes.com.mx/2025/08/Peso_Mexicano.webp,2026-01-23T23:55:46Z,"Los mercados registraron el viernes movimientos dispares, terminando una semana de ganancias, ante una ola de ventas de activos estadounidenses debido a las tensiones por los planes del presidente Do… [+2383 chars]","Los mercados registraron el viernes movimientos dispares, terminando una semana de ganancias, ante una ola de ventas de activos estadounidenses debido a las tensiones por los planes del presidente Donald Trump de controlar Groenlandia. A nivel local, la sesión estuvo marcada por la divulgación de cifras que mostraron una inesperada contracción de la actividad económica en noviembre. Los datos anteceden a un esperado informe del PIB de México del cuarto trimestre que será publicado la próxima semana. El peso se apreció 0.64% al ubicarse el tipo de cambio en 17.3677 unidades por dólar, de acuerdo con dato de cierre de Banxico. La moneda nacional hiló tres sesiones con avances y se mantuvo en su mejor nivel frente al dólar desde finales de mayo de 2024. Lee:Peso tiene mejor nivel frente al dólar desde finales de mayo de 2024 En el acumulado semanal, el peso ganó 1.58%, mientras los inversores comienzan a poner la mirada en la próxima decisión de política monetaria de la Reserva Federal estadounidense prevista para el 28 de enero. Te puede interesar: Precios del gas natural están protegidos ante tormenta invernal: CFE “Mi proyección para la próxima semana, se da en un par USD/MXN que se enfrenta a un soporte psicológico y técnico crucial en los 17.35”, dijo Felipe Mendoza, director ejecutivo de la gestora de inversiones IMB Capital Quants. “Cualquier señal de que las tasas en EU bajarán más lento de lo esperado fortalecería al dólar globalmente, lo que, sumado a la debilidad de la manufactura mexicana, podría gatillar una toma de utilidades que devuelva al tipo de cambio por encima de los 17.60”, agregó. El principal índice de la bolsa, el S&P/BMV IPC, descendió un 0.22% a 68,195.98 puntos, según datos preliminares de cierre, interrumpiendo una racha de cinco jornadas de ganancias que lo llevaron a tocar en la víspera un récord máximo histórico de 67,545.88 unidades.",Forbes México Staff,Forbes.com.mx
