source,title,description,url,image_url,published_at,content,full_text,author,source_name
newsapi,"Seguridad, industria y educación: el triángulo estratégico que define el futuro","La lección para cualquier organización es brutalmente simple: si tú planeas como si vivieras en estabilidad, estás planeando para un planeta que ya no existe.",https://www.elfinanciero.com.mx/opinion/alberto-munoz/2026/01/24/seguridad-industria-y-educacion-el-triangulo-estrategico-que-define-el-futuro/,https://www.elfinanciero.com.mx/resizer/v2/EFVF7S34MFGZJC2OKN6JBYBZUI.jpg?smart=true&auth=4ba32ef1f1aec5aa534be9275d7cba53e9ea6ca27f698c325d5b4e3e51c73066&width=1200&height=630,2026-01-25T04:15:14Z,"Buscando referencias sobre planeación estratégica moderna encontré una muestra de cómo se escribe una estrategia cuando el objetivo no es ganar una guerra sino administrar el tablero completo, con al… [+7622 chars]","Buscando referencias sobre planeación estratégica moderna encontré una muestra de cómo se escribe una estrategia cuando el objetivo no es “ganar una guerra” sino administrar el tablero completo, con aliados, rivales, cadenas industriales, tecnología, crimen transnacional y opinión pública, todo al mismo tiempo. La 2026 National Defense Strategy de USA [1] es, en el fondo, una clase acelerada de planeación estratégica aplicada: cómo convertir incertidumbre en prioridades, cómo traducir narrativa política en líneas de acción, y cómo amarrar poder militar con poder industrial y poder diplomático sin pedir permiso a la realidad. Lo primero que enseña el documento es que la estrategia moderna ya no empieza con el enemigo, sino con el sistema. El texto habla de “contested strategic environment” y de competencia global permanente: no es un conflicto puntual, es un estado del mundo. La lección para cualquier organización (empresa, gobierno, universidad) es brutalmente simple: si tú planeas como si vivieras en estabilidad, estás planeando para un planeta que ya no existe. La estrategia útil es la que asume fricción, cambios de reglas, presión externa y escenarios simultáneos. No se trata de predecir el futuro, sino de diseñar capacidades que funcionen incluso si el futuro sale mal. La segunda lección es que una estrategia no es un manifiesto: es una selección agresiva de prioridades. El documento elige y repite: China como “pacing threat”, la urgencia de reconstruir disuasión, y el énfasis en velocidad. En el lenguaje corporativo, es el equivalente a decir: “si intentamos ganar en todo, perdemos en lo importante”. La planeación estratégica real no es una lista de deseos; es una renuncia explícita a lo secundario para concentrar recursos, talento y tiempo donde la ventaja es acumulativa. Mucha planeación latinoamericana fracasa por exactamente lo contrario: se convierte en un catálogo diplomático de buenas intenciones que nadie puede financiar ni ejecutar. La tercera lección -la más incómoda- es que la estrategia actual ya no se escribe como “precisión primero”, sino como velocidad primero. El documento insiste en actuar rápido, en tener “opciones creíbles” y en reducir tiempos de decisión. Esto no es un detalle militar: es un cambio de filosofía. La velocidad se vuelve una forma de poder, porque quien decide antes fuerza al otro a responder. En la economía del conocimiento, esa lógica se parece demasiado a nuestra obsesión por el MVP: “primero que jale, luego lo perfeccionamos”. Pero aquí está la advertencia: el MVP funciona para lanzar apps; en seguridad nacional (o en política pública, o en salud) el “que jale” puede ser el inicio de un incendio. La lección estratégica es distinguir cuándo la velocidad crea ventaja y cuándo solo crea riesgo irreversible. La cuarta lección es que la inteligencia - en serio - no es “información”, sino criterio. El documento no está lleno de datos, porque ese no es su propósito. La inteligencia estratégica aquí opera como un filtro: qué amenazas merecen atención, cuáles son ruido, cuáles son distracciones baratas. En empresas, la analogía es perfecta: hoy todos tienen dashboards, pero casi nadie tiene juicio. En un mundo saturado de señales (1D), imágenes(2D), videos(3D), escenarios (4D-RGBD) y metaversos, la ventaja competitiva no es “ver más”, sino entender qué significa lo que ves. El texto enseña que el producto final de la inteligencia no es un reporte: es una prioridad, una decisión y un vector n-dimensional de inversión en tiempo, dinero, esfuerzo, personas, territorio y aliados. La quinta lección es la más moderna: el poder ya no se mide solo en tropas, sino en capacidad industrial y tecnológica. El documento insiste en fortalecer la base industrial de defensa, acelerar innovación, y asegurar cadenas de suministro. Esto tiene traducción inmediata al lenguaje económico: en la era de IA, semiconductores, energía y robótica, el país que no domina su infraestructura productiva termina alquilando su futuro. La estrategia ya no es solo doctrina: es manufactura, talento, regulaciones, ecosistema, proveedores, y una cultura de ejecución. Y eso, para México, debería consolidar la urgencia de cambio: seguimos hablando de competitividad como si fuera un slogan, cuando en realidad es una arquitectura. La sexta lección aparece en una frase que en Latinoamérica se suele leer con nerviosismo: USA dice que fortalecerá alianzas, pero también mantendrá capacidad de actuar “decisivamente” de forma unilateral si los socios “no hacen su parte”. Esto no es un llamado a la invasión; es algo más frío: es la lógica de una potencia que no quiere depender de la cooperación ajena para proteger lo que considera vital. Traducido a estrategia empresarial: colaborar sí, pero con planes de contingencia; integrarse sí, pero con control de riesgos; alianzas sí, pero sin ingenuidad. La soberanía, en el siglo XXI, se defiende también con sistemas, métricas, coordinación y resultados. Y aquí viene el cierre que n",Alberto Muñoz,El Financiero
newsapi,«Me iré de Cuba cuando caigan las bombas»,Javier Álvarez Pombo empezó dando el pésame en Vilagarcía y ahora es empresario en La Habana,https://www.lavozdegalicia.es/noticia/opinion/2026/01/25/me-ire-cuba-caigan-bombas/0003_202601A25C12992.htm,https://img.lavdg.com/sc/brLx_OVhtBbXr7Kz6U6b7Mggz44=/1280x/2026/01/24/00121769258641920554326/Foto/AE25C12F1_134257.jpg,2026-01-25T04:00:00Z,"Javier Álvarez Pombo (A Coruña, 1983) ya apuntaba maneras en el instituto. Siendo alumno del IES Armando Cotarelo de Vilagarcía, destacaba por su espíritu inquieto y ocurrente, a veces brillante, a v… [+4995 chars]","Javier Álvarez Pombo(A Coruña, 1983) ya apuntaba maneras en el instituto. Siendo alumno delIES Armando CotarelodeVilagarcía, destacaba por su espíritu inquieto y ocurrente, a veces brillante, a veces desesperante, siempre un gran relaciones públicas. Tenía dos años cuando llegó a Vilagarcía. A su padre, Paco, natural deO Barco de Valdeorras, le habían ofrecido un trabajo enClesay a su madre, Manuela, nacida enCorme, Vilagarcía le parecía una ciudad idónea para montar un herbolario. Javier compaginó enseguida los estudios con el trabajo. Su primer empleo fue en el tanatorioPompas Fúnebres de Arousay, cómo no, ejerciendo de relaciones públicas. «Mi trabajo consistía en dar el pésame. Eduardo, el propietario, debió de pensar que yo era muy simpático», recuerda con una sonrisa. Al tiempo que estudiaba Económicas en laUNED(le faltan dos asignaturas para acabar el grado), se marchó aMálaga, donde trabajó como albañil, aunque confiesa que no tenía ni idea de la profesión, no había cogido un pico y una pala en su vida y sus compañeros lo llamaban el señorito: se dedicaba a pasar la escoba y descargar algún camión. «En la construcción, pagaban un pastizal, pero quebró el sector y me pilló haciendo una obra en un hotel. Le caí bien a la directora y me contrató primero para limpiar la piscina, luego en la cocina y, como tenía una furgoneta, iba con ella por Málaga yMarbellahaciendo compras para el hotel», evoca su época andaluza. Enganchando un trabajo con otro, la directora del hotel lo ascendió a asistente. Pero Pombo, así es conocido en Vilagarcía, no es un tipo al que le guste echar raíces, así que enseguida se cansó de laCosta del Soly decidió probar fortuna enCanarias. EnFuerteventura, fue jefe de compras en un hotel y una noche, en un local llamadoSan Borondón, regentado por un uruguayo, que tocaba la guitarra, y una chica deCatoira, que cortaba jamón y servía vinos, conoció aMiguel Corbatón, director de hotelesIberostar, y acabó en laRepública Dominicanacomo jefe de compras en un hotel de Puerto Plata. Atrás dejaba una primera juventud de pésames, albañilería, hoteles y también política. «Fui secretario general deJuventudes Socialistasen Vilagarcía y en Estepona, donde me ofrecieron ser delegado provincial delInstituto Andaluz de la Juventuden Málaga, pero a mí me gusta hacer y decir lo que me da la gana y no acepté», explica. Se fue alejando de la política, aunque no esconde sus ideas: «Soy de izquierdas, pero digo lo que pienso y estoy decepcionado de la política en general. Esto parece una jaula de grillos, no hay respeto ni educación». Vuelve a casa por Navidad Charlamos en la cafetería El Huerto del Cura de Vilagarcía. Pombo regresa a su ciudad todos los años, coincidiendo con la Navidad y Fitur. Al tiempo que se publica esta conversación, su avión estará aterrizando enLa Habana. ¿Pero cómo llegó nuestro hombre aCuba? «Pues de puñetera casualidad. En América me mandaron a abrir hoteles en Jamaica,MéxicoyBrasilhasta que, por fin, me tocó abrir un hotel Iberostar en Cuba, me vieron trabajar los de Meliá y me ficharon», detalla. «En Cuba, tengo mi agencia de viajes, hago asesorías para hoteles y, fundamentalmente, estoy centrado en la organización de eventos, sobre todo para organismos deNaciones Unidas. En el 2024, hicimos 98 y el año pasado, más de cien», calcula y resume su trabajo con pasión: «Me gusta aportar firmeza y exigencia combinada con cariño, gestionar equipos estresados, persuadir, cohesionar».",J.R. Alonso de la torre,Lavozdegalicia.es
newsapi,Las lecciones de la ofensiva de Trump contra Canadá,La amenaza lanzada por Donald Trump a Canadá es un recordatorio brutal de la lógica con la que el presidente de EU está reordenando el tablero comercial global.,https://www.elfinanciero.com.mx/opinion/enrique-quintana/2026/01/24/las-lecciones-de-la-ofensiva-de-trump-contra-canada/,https://www.elfinanciero.com.mx/resizer/v2/6HZGJYNDARBG7MB7M4OPNT4HPI.jpg?smart=true&auth=4468657393f1e0dbaa00951371912f9563150107d687c2e6237564817191970f&width=1200&height=630,2026-01-25T03:41:12Z,"La amenaza lanzada ayer por Donald Trump a Canadá es un recordatorio brutal de la lógica con la que el presidente de EE.UU. está reordenando el tablero comercial global.
Advertir que impondrá un ara… [+6209 chars]","La amenaza lanzada ayer por Donald Trump a Canadá esun recordatorio brutal de la lógica con la que el presidente de EE.UU.está reordenando el tablero comercial global. Advertir que impondráun arancel de 100 por ciento a Canadási hace efectivo un acuerdo con China no es una discusión técnica ni jurídica: es una señal política con consecuencias económicas inmediatas. En el mundo de Trump, la diversificación de alianzas se tolera solo hasta el punto en que no desafíe la primacía estadounidense. Cuando lo hace, se castiga. La mayor parte de los expertosduda de la viabilidad de un arancel asíporque sería contraproducente para Estados Unidos. Dispararía la inflación y erosionaría cadenas de suministro. Pero, este episodio sirve como punto de partida para observar lasdistintas estrategias que han seguido varios países frente a Trumpy, sobre todo, los resultados que han obtenido. No hay una sola fórmula, pero sí patrones claros. Canadá ofrece un caso particularmente ilustrativo. Bajo el liderazgo de Mark Carney, ha buscado ampliar su margen de maniobra internacional, incluyendo un acercamiento más visible a China. El problema no es la diversificación en sí, sino la profundidad de su integración con Estados Unidos. Cuando Trump amenaza con un arancel generalizado, no apunta a un sector específico, sino a la economía canadiense en su conjunto, con efectos inmediatos sobre inversión, expectativas y cadenas de suministro. En la lógica trumpista,cualquier acuerdo con Chinaes interpretadocomo una puerta trasera para eludir su estrategia de contención, y por eso la respuesta es desproporcionada. Canadá descubre así que diversificar sin reducir dependencia previa implica asumir costos políticos y económicos inmediatos. Europa juega un juego distinto. La Unión Europea no puede reaccionar con rapidez ni con una sola voz, pero ha desarrollado una estrategia de disuasión estructural. Su respuesta no es el choque frontal, sino laconstrucción de capacidad de represalia creíble. Por un lado, mantiene listos paquetes de contramedidas arancelarias de gran escala que se activan o suspenden según el contexto político. Por otro, ha diseñado instrumentos como el llamado ‘Anti-Coercion Instrument’, concebido para responder a presiones económicas unilaterales. No siempre se utiliza, pero su sola existencia funciona como amenaza latente, porqueel mercado europeo es demasiado grande para ser ignorado.",Enrique Quintana,El Financiero
newsapi,"Trump y Milei, parecidos, pero no iguales","Trump y Milei, parecidos, pero no iguales",https://www.lanacion.com.ar/opinion/trump-y-milei-parecidos-pero-no-iguales-nid25012026/,https://arc-static.glanacion.com/pf/resources/images/placeholderLN-1200x630.png?d=1936,2026-01-25T03:05:00Z,Creen que nadie hizo tanto ni tan bien como ellos para mejorar sus países. El narcisismo de Donald Trump lo arrastra hasta tener la convicción de que él es único en la historia de los Estados Unidos.… [+12126 chars],"Creen que nadie hizo tanto ni tan bien como ellos para mejorar sus países. El narcisismo deDonald Trumplo arrastra hasta tener la convicción de que él es único en la historia de los Estados Unidos. La egolatría de Javier Milei lo lleva a compararse con los líderes de la organización nacional y con los que hicieron de la Argentina, a fines del siglo XIX y principios del XX, una de las principales naciones del mundo.Ambos se sienten propietarios exclusivos y definitivos de la verdad. Los dos les han dado más poder a los servicios de inteligencia, convencidos de que alguien (o algunos o muchos) los persigue para destruirlos. Ambos odian al periodismo que conserva su independencia, y solo se acercan a los periodistas que profesan una comprobada y absoluta adhesión a ellos. En su imprescindible libroFrente al poder,Martin Baron, el exdirector delTheWashington Post, cuenta que Trump le pidió el teléfono personal para luego enviarle mensajes exigiéndole que despidiera a periodistas que habían escrito artículos que no le gustaban. Milei suele hacer cosas similares con su teléfono.La última palabra de los dos es siempre la penúltima. Trump ocupa y desocupaGroenlandiatodos los días, y promete colocarle aranceles y después promete sacárselos a los productos de los países europeos. Milei dijo que no le interesaban “los comunistas”, cuando hace algún tiempo aludió aChina, pero acaba de modificar aquel discurso: “China es una fuente de oportunidades”, cambió enDavos. Trump y Milei se sienten propietarios exclusivos y definitivos de la verdad Solo un presidente con una valoración muy grande de sí mismo se animaría a viajar casi 12.000 kilómetros para anunciar queNicolás Maquiaveloha muerto.Ni Trump se animó a tanto. Con sus acierto y sus errores, y con el extravío garrafal de separar la moral de la política, Maquiavelo influyó durante 500 años en el pensamiento político del mundo. El mandatario argentino, según la interpretación que se hizo de su ilusorio anuncio, quiso decir que no es cierto que el fin justifica los medios. Muy bien, pero esa frase no la escribió Maquiavelo; fue una interpretación personal queNapoleón Bonapartegarabateó en el margen de una página del libroEl Príncipe, la obra más célebre del intelectual florentino.Los parecidos entre Trump y Milei concluyen ahí, porque el presidente argentino no tiene espaldas para imitar a su par norteamericano en materia de bravuconadas internacionales. Solo un Trump implacable y brutal pudo imaginar un organismo multilateral con él como presidente vitalicio y habiéndose atribuido el poder de decidir, aprobar y vetar sus resoluciones. Solo un presidente tan poco aferrado a las formas como Milei pudo acompañarlo a Trump con su firma en esa rusticidad política, que es lo que sucedió el jueves último. El supuestoConsejo para la Pazno está integrado por ninguna otra nación delG7, el club de países más exclusivo del mundo, y solo por otras dos delG20,Arabia SauditayTurquía, además de losEstados Unidosy laArgentina. El Consejo para la Paz de Trump quedó reducido a países árabes (que necesitan la paz en su región a cualquier precio, con la excepción deIrán) y a naciones de escasa o nula influencia en la política internacional. De hecho, ningún otro país de América latina lo integra; se notó la ausencia, sobre todo, de las dos mayores economías latinoamericanas:MéxicoyBrasil. Nadie puede señalar con honestidad intelectual que Milei le respondió a Trump en el foro de Davos, porque el argentino habló inmediatamente después del norteamericano y leyó un discurso que preparó durante quince días. Pero las diferencias entre ellos fueron notables, más que nada en los párrafos en los que Milei defendió la cultura de Occidente. Los valores de Occidente pueden resumirse en la supremacía de los derechos de las personas, en el liberalismo, en el constitucionalismo, en la igualdad de los seres humanos, en la libertad, en el imperio de la ley, en la democracia y en el libre mercado.Aparece la duda de si Milei considera la cultura de Occidente solo en sus aspectos económicos y a la libertad solo como la libertad del mercado. No sería el primero, porque ese error lo cometieron muchos argentinos durante repetidas veces. Una confusión de Milei es fácilmente comprobable: él suele ignorar el derecho de sus conciudadanos a expresar libremente sus ideas, siempre que no sean las suyas, y parece no saber que los funcionarios públicos tienen más deberes que la gente común. De todos modos,Milei ponderó a Occidente, mientras Trump está destruyendo en los hechos la alianza occidental que le dio al mundo seguridad y prosperidad en los últimos 80 años. Como dijo en su excelente discurso en Davos el primer ministro canadiense,Mark Carney: “El orden basado en normas se está desvaneciendo. Los fuertes hacen lo que pueden, y los débiles sufren lo que deben”, subrayó, y agregó: “Dejemos de invocar el orden internacional basado en normas (…) porque el viejo orden no va a volver”. El párrafo de Milei que más clara",Joaquín Morales Solá,La Nacion
newsapi,Delcy Rodríguez llama a un diálogo con todos los sectores de Venezuela para la convivencia y paz,"La presidenta encargada, Delcy Rodríguez, ha convocado un diálogo con todos los sectores de Venezuela, «coincidentes y divergentes», como los definió, para incorporarse al Programa de Convivencia y la Paz que funcionará durante los próximos 100 días. Su plan …",https://www.abc.es/internacional/delcy-rodriguez-llama-dialogo-sectores-venezuela-convivencia-20260125020150-nt.html,https://s2.abcstatics.com/abc/www/multimedia/internacional/2026/01/25/1505440562-kFZH--1024x512@diario_abc.jpg,2026-01-25T01:01:52Z,"La presidenta encargada, Delcy Rodríguez, ha convocado un diálogo con todos los sectores de Venezuela, «coincidentes y divergentes», como los definió, para incorporarse al Programa de Convivencia y l… [+4932 chars]"," Ludmila Vinogradoff Corresponsal en Caracas Esta funcionalidad es sólo para registrados Esta funcionalidad es sólo para registrados Esta funcionalidad es sólo para suscriptores La presidenta encargada,Delcy Rodríguez,ha convocado un diálogo con todos los sectores de Venezuela, «coincidentes y divergentes», como los definió, para incorporarse alPrograma de Convivencia y la Pazque funcionará durante los próximos 100 días. Su plan de pacificación y reconciliación, dirigida por...ella directamente, fue lanzado oficialmente este viernes en el salón 'Sol de Perú', en el Palacio de Miraflores, donde la mandataria interina designada el 5 de enero pasado, subrayó que el país «transita hacia unnuevo momento políticocaracterizado por el entendimiento desde la diversidad, dejando atrás los esquemas de confrontación promovidos por sectores externos». La presidenta encargada de Venezuela mantiene un discurso de resistencia frente a la potencia que orquestó la captura de su predecesor La interina pidió a su hermano,Jorge Rodríguez,presidente de la Asamblea Nacional, también presidente del Consejo Nacional de Soberanía y Paz, que activara esta instancia. El jefe del Parlamento dijo que esta instancia busca «emprender con todos los factores el diálogo político que requiere este momento complejo que vive la República».",(abc),Www.abc.es
newsapi,Brasil asume representación diplomática de la embajada de México en Perú,"Associated Press LIMA (AP) — Más de dos meses después de la ruptura de relaciones entre Perú y México, la cancillería peruana informó el sábado que Brasil queda a cargo de la representación diplomática del país norteamericano en su territorio, por lo que desd…",https://www.bostonherald.com/2026/01/24/brasil-asume-representacin-diplomtica-de-la-embajada-de-mxico-en-per/,https://www.bostonherald.com/wp-content/uploads/2018/11/Herald_BridgePhoto.jpg,2026-01-24T23:55:35Z,"Associated Press
LIMA (AP) — Más de dos meses después de la ruptura de relaciones entre Perú y México, la cancillería peruana informó el sábado que Brasil queda a cargo de la representación diplomát… [+1917 chars]","Associated Press LIMA (AP) — Más de dos meses después de laruptura de relaciones entre Perú y México, la cancillería peruana informó el sábado que Brasil queda a cargo de la representación diplomática del país norteamericano en su territorio, por lo que desde este día flamea la bandera auriverde en la sede azteca en Lima. Perú rompió relaciones con México a inicios de noviembre por conceder asilo a la ex primera ministra Betssy Chávez, que había sido sentenciada a más de 11 años de prisión por rebelión. Las autoridades peruanas rechazaron el acto considerado “inamistoso”, por el uso “indebido” del derecho internacional ya que Chávez fue condenada por un delito común y no es una perseguida política, señalaron. “Brasil se ha hecho cargo” de la sede diplomática luego de las coordinaciones respectivas con Perú, indicó el encargado de la oficina de prensa de la cancillería peruana, Luis Enrique Castillo, ante las consultas de periodistas. “Al haberse roto las relaciones diplomáticas con México, este país tiene el derecho de solicitar que otro país se encargue de sus asuntos diplomáticos”, mencionó el funcionario, pero aclaró que Brasil no podrá tramitar asuntos “consulares ni económicos”. Hasta el momento, ninguna de las autoridades de los países involucrados se ha referido a la situación de Chávez tras el encargo diplomático a Brasil. La bandera de Brasil ondeó sorpresivamente desde el sábado en la sede de la embajada de México en la capital peruana, donde además policías custodian las instalaciones con el fin de evitar un posibleescape de la ex primera ministra Chávez, asilada desde el 3 de noviembre. Chávez está acusada en calidad de coautora del presunto delito de rebelión por su participación en la iniciativa del expresidente Pedro Castillo (2021-2022) de disponer la disolución del Congreso el 7 de diciembre de 2022, lo que finalmente derivó en sudestitución. Tras conocer del asilo concedido a Chávez, el Congreso peruano declarópersona no grata a la presidenta mexicana Claudia Sheinbaum, calificando al acto de “injerencia” en los asuntos internos del país sudamericano.",Associated Press Spanish,Boston Herald
